{
  "modelEntityId": "AF-0000000300000001",
  "latestVersion": 1,
  "providerId": "EXAMPLE",
  "isComplex": false,
  "isUniProt": true,
  "uniprotAccession": [
    "O00400"
  ],
  "uniprotDescription": [
    "Acetyl-coenzyme A transporter 1"
  ],
  "isUniProtReferenceProteome": true,
  "isUniProtReviewed": true,
  "isIsoform": false,
  "organismScientificName": [
    "Homo sapiens (Human)"
  ],
  "gene": [
    "SLC33A1"
  ],
  "taxId": [
    9606
  ],
  "sequenceStart": 1,
  "sequenceEnd": 549,
  "globalMetricValue": 81.38,
  "isAMdata": false
}
